<?xml version='1.0' encoding='utf-8'?>
<!DOCTYPE network SYSTEM '../network.dtd'>
<network failure_handling="false" pubsub_reliable="true">
    <build>
        <!--	path: filepath to the make binary (optional)
			args: parameters you can specify for make (optional)
			root: the directory that contains the Makefile
			output: the binary file generated by the project
		-->
        <make output="diaforus_final_code" root="Default/" target="host" args="-j8"/>
        <make output="diaforus_final_code.jtag.s3" root="Debug/" target="aps3" args="-j1"/>
        <debug pubsub="true" uip="true" sicslowpan="true" rpl="true" wavesim="true" coap="truz" reasoning="true"/>
        <application name="REASONING"/>
    </build>
    <coap_groups>
        <group name="reasoning1">
            <resource name="intrusion_duration"/>
            <resource name="latency_mode"/>
        </group>
        <group name="reasoning2">
            <resource name="hist_analyze_per"/>
            <resource name="criticality_lvl"/>
            <resource name="history"/>
            <resource name="alert_alarm_ratio"/>
        </group>
        <group name="rpl">
            <resource name="rpl_neighbors"/>
            <resource name="rpl_rank"/>
            <resource name="rpl_num_routes"/>
            <resource name="rpl_num_tra_mess"/>
            <resource name="rpl_num_rec_mess"/>
        </group>
        <group name="allnodes">
            <resource name="num_tra_packets"/>
            <resource name="num_rec_packets"/>
            <resource name="nodeid"/>
        </group>
    </coap_groups>
    <!-- Zone 1 -->
    <node target="host" simulation="false" id="20" area="1" name="node root reasoning 1">
        <firmware name="node_20"/>
        <phy x="910" y="865" range="900"/>
        <energy startup="1600" alarm="100"/>
        <rpl>
            <restrict_neighbors>
                <neighbor node_id="1"/>
                <neighbor node_id="2"/>
                <neighbor node_id="3"/>
                <neighbor node_id="4"/>
            </restrict_neighbors>
        </rpl>
        <pubsub enable="true"/>
        <coap enable="true">
            <group name="reasoning2"/>
            <group name="rpl"/>
            <group name="allnodes"/>
        </coap>
        <!-- The parameters to control the reasoning (level 1 and level 2) -->
        <reasoning latency_mode="green" max_intrusion_duration="10" min_intrusion_duration="5">
            <!-- This node is the reasoning node -->
            <reasoning_node log_analyse_period="1440"/>
        </reasoning>
        <sensors/>
    </node>
    <node target="aps3" simulation="false" id="2" area="1" name="node pir 2-1">
        <firmware name="node_2.jtag.s3"/>
        <phy x="786" y="856" range="900"/>
        <energy startup="1600" alarm="100"/>
        <rpl>
            <restrict_neighbors>
                <neighbor node_id="1"/>
            </restrict_neighbors>
        </rpl>
        <pubsub enable="true"/>
        <coap enable="true">
            <group name="reasoning1"/>
            <group name="rpl"/>
            <group name="allnodes"/>
        </coap>
        <reasoning latency_mode="green" max_intrusion_duration="10" min_intrusion_duration="5"/>
        <sensors>
            <modality type="PIR">
                <sensor period="200" reemission_delay="3001" type="digital" id="0" delay="0">
                    <gpio pin="2"/>
                    <value abs_threshold="1" rel_threshold="1" invert="false"/>
                    <position x="738" y="798" z_rotation="-110"/>
                </sensor>
            </modality>
        </sensors>
    </node>
    <node target="aps3" simulation="false" id="5" area="1" name="node pir 2-1">
        <firmware name="node_5.jtag.s3"/>
        <phy x="846" y="743" range="900"/>
        <energy startup="1600" alarm="100"/>
        <rpl>
            <restrict_neighbors>
                <neighbor node_id="1"/>
            </restrict_neighbors>
        </rpl>
        <pubsub enable="true"/>
        <coap enable="true">
            <group name="reasoning1"/>
            <group name="rpl"/>
            <group name="allnodes"/>
        </coap>
        <parameter value="-136" name="M_FREQ_OFFSET"/>
        <reasoning latency_mode="green" max_intrusion_duration="10" min_intrusion_duration="5"/>
        <sensors>
            <modality type="SEISMIC">
                <sensor period="200" reemission_delay="3001" type="digital" id="0" delay="0">
                    <gpio pin="2"/>
                    <value abs_threshold="1" rel_threshold="1" invert="false"/>
                    <position x="819" y="719" z_rotation="155"/>
                </sensor>
            </modality>
        </sensors>
    </node>
    <node target="aps3" simulation="false" id="3" area="1" name="node pir 3-1">
        <firmware name="node_3.jtag.s3"/>
        <phy x="956" y="799" range="900"/>
        <energy startup="1600" alarm="100"/>
        <rpl>
            <restrict_neighbors>
                <neighbor node_id="1"/>
            </restrict_neighbors>
        </rpl>
        <pubsub enable="true"/>
        <coap enable="true">
            <group name="reasoning1"/>
            <group name="rpl"/>
            <group name="allnodes"/>
        </coap>
        <reasoning latency_mode="green" max_intrusion_duration="10" min_intrusion_duration="5"/>
        <sensors>
            <modality type="PIR">
                <sensor period="200" reemission_delay="3001" type="digital" id="0" delay="0">
                    <gpio pin="2"/>
                    <value abs_threshold="1" rel_threshold="1" invert="false"/>
                    <position x="905" y="738" z_rotation="-110"/>
                </sensor>
            </modality>
        </sensors>
    </node>
    <node target="host" simulation="true" id="9" area="1" name="mobile C2">
        <emblem source="c2.png"/>
        <firmware name="node_9"/>
        <phy x="629" y="616" range="900"/>
        <energy startup="1600" alarm="100"/>
        <rpl>
        	<restrict_neighbors>
				<neighbor node_id="2" />
			</restrict_neighbors>
		</rpl> 
        <pubsub enable="false" broker="true"/>
        <coap enable="true">
            <group name="reasoning2"/>
            <group name="rpl"/>
            <group name="allnodes"/>
        </coap>
        <gateway port="1235"/>
        <!-- The parameters to control the reasoning (level 1 and level 2) -->
        <reasoning latency_mode="orange" max_intrusion_duration="20" min_intrusion_duration="2"/>
         <parameter name="INDOOR_SCENARIO" value="1" />
         <parameter name="MOBILE_C2" value="1" />
        <sensors/>
    </node>
</network>
