<?xml version='1.0' encoding='utf-8'?>
<!DOCTYPE network SYSTEM '../network.dtd'>
<network failure_handling="true" pubsub_reliable="true">
    <build>
        <!--	path: filepath to the make binary (optional)
			args: parameters you can specify for make (optional)
			root: the directory that contains the Makefile
			output: the binary file generated by the project
		-->
        <make output="diaforus_final_code" root="build/" target="host" args="-j8"/>
        <make output="diaforus_final_code.jtag.s3" root="Debug/" target="aps3" args="-j1"/>
        <debug pubsub="true" uip="false" sicslowpan="false" rpl="false" wavesim="false" coap="true" reasoning="true"/>
        <application name="REASONING"/>
    </build>
    <coap_groups>
        <group name="reasoning1">
            <resource name="intrusion_duration"/>
            <resource name="latency_mode"/>
        </group>
        <group name="reasoning2">
            <resource name="hist_analyze_per"/>
            <resource name="criticality_lvl"/>
            <resource name="history"/>
            <resource name="alert_alarm_ratio"/>
        </group>
        <group name="rpl">
            <resource name="rpl_neighbors"/>
            <resource name="rpl_rank"/>
            <resource name="rpl_num_routes"/>
            <resource name="rpl_num_tra_mess"/>
            <resource name="rpl_num_rec_mess"/>
        </group>
        <group name="allnodes">
            <resource name="num_tra_packets"/>
            <resource name="num_rec_packets"/>
            <resource name="nodeid"/>
        </group>
    </coap_groups>
    <!-- Zone 2 -->
    <node target="host" simulation="true" id="1" area="2" name="node root broker">
        <emblem source="c2.png"/>
        <firmware name="node_1"/>
         <phy x="1100" y="937" range="900"/>
        <energy startup="1600" alarm="100"/>
        <rpl prefix="1180:0000:0000:0000">
            <restrict_neighbors>
                <neighbor node_id="2"/>
                <neighbor node_id="7"/>
            </restrict_neighbors>
        </rpl>
        <pubsub enable="true" broker="true"/>
        <coap enable="true">
            <group name="reasoning2"/>
            <group name="rpl"/>
            <group name="allnodes"/>
        </coap>
        <gateway port="1235"/>
        <!-- The parameters to control the reasoning (level 1 and level 2) -->
        <reasoning latency_mode="white" max_intrusion_duration="5" min_intrusion_duration="2"/>
        <parameter value="1" name="INDOOR_SCENARIO"/>
        <sensors/>
    </node>
    <node target="host" simulation="true" id="7" area="2" name="node reasoning 2">
        <firmware name="node_7"/>
        <phy x="1200" y="746" range="900"/>
        <energy startup="1600" alarm="100"/>
        <rpl>
            <restrict_neighbors>
                <neighbor node_id="1"/>
				<neighbor node_id="2"/>
				<neighbor node_id="3"/>
            </restrict_neighbors>
        </rpl>
        <pubsub enable="true"/>
        <coap enable="true">
            <group name="reasoning2"/>
            <group name="rpl"/>
            <group name="allnodes"/>
        </coap>
        <!-- The parameters to control the reasoning (level 1 and level 2) -->
        <reasoning latency_mode="white" max_intrusion_duration="5" min_intrusion_duration="2">
            <!-- This node is the reasoning node -->
            <reasoning_node log_analyse_period="1440"/>
            <!-- in minutes -->
            <monitored_area area="1" average_crossing_duration="10"/>
        </reasoning>
        <parameter value="1" name="INDOOR_SCENARIO"/>
        <sensors/>
    </node>
    <node target="host" simulation="true" id="2" area="2" name="node pir 3">
        <firmware name="node_2"/>
        <phy x="1058" y="746" range="900"/>
        <energy startup="1600" alarm="100"/>
        <rpl>
            <restrict_neighbors>
                <neighbor node_id="1"/>
				<neighbor node_id="3"/>
				<neighbor node_id="7"/>
            </restrict_neighbors>
        </rpl>
        <pubsub enable="true"/>
        <coap enable="true">
            <group name="reasoning1"/>
            <group name="rpl"/>
            <group name="allnodes"/>
        </coap>
        <reasoning latency_mode="white" max_intrusion_duration="5" min_intrusion_duration="2"/>
        <parameter value="1" name="INDOOR_SCENARIO"/>
        <sensors>
            <modality type="PIR">
                <sensor period="200" type="digital" id="0" delay="0">
                    <gpio pin="2"/>
                    <value abs_threshold="1" rel_threshold="1" invert="false"/>
                    <position x="996" y="770" z_rotation="180"/>
                </sensor>
            </modality>
        </sensors>
    </node>
    <node target="host" simulation="true" id="3" area="2" name="node spirit">
        <firmware name="node_3"/>
        <phy x="1000" y="515" range="400"/>
        <energy startup="1600" alarm="100"/>
        <rpl>
            <restrict_neighbors>
                <neighbor node_id="2"/>
                <neighbor node_id="7"/>
            </restrict_neighbors>
        </rpl>
        <pubsub enable="true"/>
        <coap enable="true">
            <group name="reasoning1"/>
            <group name="rpl"/>
            <group name="allnodes"/>
        </coap>
        <reasoning latency_mode="white" max_intrusion_duration="5" min_intrusion_duration="2"/>
        <parameter value="1" name="INDOOR_SCENARIO"/>
        <sensors>
            <modality type="PIR">
                <sensor period="200" type="digital" id="0" delay="0">
                    <gpio pin="2"/>
                    <value abs_threshold="1" rel_threshold="1" invert="false"/>
                    <position x="920" y="542" z_rotation="160"/>
                </sensor>
            </modality>
        </sensors>
    </node>
</network>
